work_id,title,abstract_inverted_index,publication_year,type,language
102353644,Outlier Detection for Improved Data Quality and Diversity in Dialog Systems,"In a corpus of data, outliers are either errors: mistakes in the data that are counterproductive, or are unique: informative samples that improve model robustness. Identifying outliers can lead to better datasets by (1) removing noise in datasets and (2) guiding collection of additional data to fill gaps. However, the problem of detecting both outlier types has received relatively little attention in NLP, particularly for dialog systems. We introduce a simple and effective technique for detecting both erroneous and unique samples in a corpus of short texts using neural sentence embeddings combined with distance-based outlier detection. We also present a novel data collection pipeline built atop our detection technique to automatically and iteratively mine unique data samples while discarding erroneous samples. Experiments show that our outlier detection technique is effective at finding errors while our data collection pipeline yields highly diverse corpora that in turn produce more robust intent classification and slot-filling models.",,,
104292008,A Target-Agnostic Attack on Deep Models: Exploiting Security Vulnerabilities of Transfer Learning,"Due to the lack of enough training data and high computational cost to train a deep neural network from scratch, transfer learning has been extensively used in many deep-neural-network-based applications, such as face recognition, image classification, speech recognition, etc. A commonly-used transfer learning approach involves taking a part of a pre-trained model, adding a few layers at the end, and re-training the new layers with a small dataset. This approach, while efficient and widely used, imposes a security vulnerability because the pre-trained models used in transfer learning are usually available publicly to everyone, including potential attackers. In this paper, we show that without any additional knowledge other than the pre-trained model, an attacker can launch an effective and efficient brute force attack that can craft instances of input to trigger each target class with high confidence. Note that we assume that the attacker does not have access to any targetspecific information, including samples from target classes, re-trained model, and probabilities assigned by Softmax to each class, and thus called target-agnostic attack. These assumptions render all previous attacks impractical, to the best of our knowledge. To evaluate the proposed attack, we perform a set of experiments on face recognition and speech recognition tasks and show the effectiveness of the attack. Our work sheds light on a fundamental security challenge of transfer learning in deep neural networks.",,,
10432942,Translating Granularity of Event Slots into Features for Event Coreference Resolution,"Using clues from event semantics to solve coreference, we present an ""event template"" approach to cross-document event coreference resolution on news articles. The approach uses a pairwise model, in which event information is compared along five semantically motivated slots of an event template. The templates, filled in on the sentence level for every event mention from the data set, are used for supervised classification. In this study, we determine granularity of events and we use the grain size as a clue for solving event coreference. We experiment with a newly-created granularity ontology employing granularity levels of locations, times and human participants as well as event durations as features in event coreference resolution. The granularity ontology is available for research. Results show that determining granularity along semantic event slots, even on the sentence level exclusively, improves precision and solves event coreference with scores comparable to those achieved in related work.",,,
108308108,ENVIRONMENT PROBING INTERACTION POLICIES,"A key challenge in reinforcement learning (RL) is environment generalization: a policy trained to solve a task in one environment often fails to solve the same task in a slightly different test environment. A common approach to improve interenvironment transfer is to learn policies that are invariant to the distribution of testing environments. However, we argue that instead of being invariant, the policy should identify the specific nuances of an environment and exploit them to achieve better performance. In this work, we propose the ""Environment-Probing"" Interaction (EPI) policy, a policy that probes a new environment to extract an implicit understanding of that environment's behavior. Once this environmentspecific information is obtained, it is used as an additional input to a task-specific policy that can now perform environment-conditioned actions to solve a task. To learn these EPI-policies, we present a reward function based on transition predictability. Specifically, a higher reward is given if the trajectory generated by the EPI-policy can be used to better predict transitions. We experimentally show that EPI-conditioned task-specific policies significantly outperform commonly used policy generalization methods on novel testing environments.",,,
12122362,Published as a conference paper at ICLR 2017 LEARNING TO REMEMBER RARE EVENTS,"Despite recent advances, memory-augmented deep neural networks are still limited when it comes to life-long and one-shot learning, especially in remembering rare events. We present a large-scale life-long memory module for use in deep learning. The module exploits fast nearest-neighbor algorithms for efficiency and thus scales to large memory sizes. Except for the nearest-neighbor query, the module is fully differentiable and trained end-to-end with no extra supervision. It operates in a life-long manner, i.e., without the need to reset it during training. Our memory module can be easily added to any part of a supervised neural network. To show its versatility we add it to a number of networks, from simple convolutional ones tested on image classification to deep sequence-to-sequence and recurrent-convolutional models. In all cases, the enhanced network gains the ability to remember and do life-long one-shot learning. Our module remembers training examples shown many thousands of steps in the past and it can successfully generalize from them. We set new state-of-the-art for one-shot learning on the Omniglot dataset and demonstrate, for the first time, life-long one-shot learning in recurrent neural networks on a large-scale machine translation task. * First two authors contributed equally. † Work done as a member of the Google Brain Residency program (g.co/brainresidency). ‡ Work done during internship at Google Brain.",,,
12308095,COUNTERING ADVERSARIAL IMAGES USING INPUT TRANSFORMATIONS,"This paper investigates strategies that defend against adversarial-example attacks on image-classification systems by transforming the inputs before feeding them to the system. Specifically, we study applying image transformations such as bit-depth reduction, JPEG compression, total variance minimization, and image quilting before feeding the image to a convolutional network classifier. Our experiments on ImageNet show that total variance minimization and image quilting are very effective defenses in practice, in particular, when the network is trained on transformed images. The strength of those defenses lies in their non-differentiable nature and their inherent randomness, which makes it difficult for an adversary to circumvent the defenses. Our best defense eliminates 60% of strong gray-box and 90% of strong black-box attacks by a variety of major attack methods.",,,
12730344,An Empirical Investigation of Catastrophic Forgetting in Gradient-Based Neural Networks,"Catastrophic forgetting is a problem faced by many machine learning models and algorithms. When trained on one task, then trained on a second task, many machine learning models ""forget"" how to perform the first task. This is widely believed to be a serious problem for neural networks. Here, we investigate the extent to which the catastrophic forgetting problem occurs for modern neural networks, comparing both established and recent gradient-based training algorithms and activation functions. We also examine the effect of the relationship between the first task and the second task on catastrophic forgetting. We find that it is always best to train using the dropout algorithmthe dropout algorithm is consistently best at adapting to the new task, remembering the old task, and has the best tradeoff curve between these two extremes. We find that different tasks and relationships between tasks result in very different rankings of activation function performance. This suggests that the choice of activation function should always be cross-validated.",,,
12734615,Workshop track -ICLR 2017 PARTICLE VALUE FUNCTIONS,"The policy gradients of the expected return objective can react slowly to rare rewards. Yet, in some cases agents may wish to emphasize the low or high returns regardless of their probability. Borrowing from the economics and control literature, we review the risk-sensitive value function that arises from an exponential utility and illustrate its effects on an example. This risk-sensitive value function is not always applicable to reinforcement learning problems, so we introduce the particle value function defined by a particle filter over the distributions of an agent's experience, which bounds the risk-sensitive one. We illustrate the benefit of the policy gradients of this objective in Cliffworld.Stefano Coraluppi. Optimal control of Markov decision processes for performance and robustness. . Risk-sensitive Markov decision processes. Management science, 18(7):356-369, 1972. Nikolas Kantas. Sequential decision making in general state space models. PhD thesis, Citeseer, 2009. Nikolas Kantas, Arnaud Doucet, Sumeetpal S Singh, Jan Maciejowski, Nicolas Chopin, et al. On particle methods for parameter estimation in state-space models. Statistical science, 30(3):328-351, 2015. Hilbert J Kappen. Linear theory for control of nonlinear stochastic systems. Physical review letters, 95(20):200201, 2005. Hilbert J Kappen, Vicenç Gómez, and Manfred Opper. Optimal control as a graphical model inference problem. Machine learning, 87(2):159-182, 2012. Sven Koenig and Reid G Simmons. Risk-sensitive planning with probabilistic decision graphs. In . On some properties of markov chain monte carlo simulation methods based on the particle filter. Journal of Econometrics, . Risk-sensitive reinforcement learning. Neural computation, 26(7):1298-1328, 2014. Naftali Tishby and Daniel Polani. Information theory of decisions and actions. In Perception-action cycle, pp. 601-636. Springer, 2011. Emanuel Todorov. Linearly-solvable markov decision problems. In NIPS, pp. 1369-1376, 2006. Marc Toussaint and Amos Storkey. Probabilistic inference for solving discrete and continuous state markov decision processes. In Proceedings of the 23rd international conference on Machine learning, pp. 945-952. ACM, 2006. John Von Neumann and Oskar Morgenstern. Theory of games and economic behavior. Princeton University Press, 1953. Ronald J Williams. Simple statistical gradient-following algorithms for connectionist reinforcement learning. Machine learning, 8(3-4):229-256, 1992.",,,
13395552,Learning to Optimize,"Algorithm design is a laborious process and often requires many iterations of ideation and validation. In this paper, we explore automating algorithm design and present a method to learn an optimization algorithm, which we believe to be the first method that can automatically discover a better algorithm. We approach this problem from a reinforcement learning perspective and represent any particular optimization algorithm as a policy. We learn an optimization algorithm using guided policy search and demonstrate that the resulting algorithm outperforms existing hand-engineered algorithms in terms of convergence speed and/or the final objective value.",,,
13468104,WORD REPRESENTATIONS VIA GAUSSIAN EMBEDDING,"Current work in lexical distributed representations maps each word to a point vector in low-dimensional space. Mapping instead to a density provides many interesting advantages, including better capturing uncertainty about a representation and its relationships, expressing asymmetries more naturally than dot product or cosine similarity, and enabling more expressive parameterization of decision boundaries. This paper advocates for density-based distributed embeddings and presents a method for learning representations in the space of Gaussian distributions. We compare performance on various word embedding benchmarks, investigate the ability of these embeddings to model entailment and other asymmetric relationships, and explore novel properties of the representation.",,,
13495961,A Character-Level Decoder without Explicit Segmentation for Neural Machine Translation,"The existing machine translation systems, whether phrase-based or neural, have relied almost exclusively on word-level modelling with explicit segmentation. In this paper, we ask a fundamental question: can neural machine translation generate a character sequence without any explicit segmentation? To answer this question, we evaluate an attention-based encoderdecoder with a subword-level encoder and a character-level decoder on four language pairs-En-Cs, En-De, En-Ru and En-Fiusing the parallel corpora from WMT'15. Our experiments show that the models with a character-level decoder outperform the ones with a subword-level decoder on all of the four language pairs. Furthermore, the ensembles of neural models with a character-level decoder outperform the state-of-the-art non-neural machine translation systems on En-Cs, En-De and En-Fi and perform comparably on En-Ru.",,,
13900194,Certifying Some Distributional Robustness with Principled Adversarial Training,"Neural networks are vulnerable to adversarial examples and researchers have proposed many heuristic attack and defense mechanisms. We address this problem through the principled lens of distributionally robust optimization, which guarantees performance under adversarial input perturbations. By considering a Lagrangian penalty formulation of perturbing the underlying data distribution in a Wasserstein ball, we provide a training procedure that augments model parameter updates with worst-case perturbations of training data. For smooth losses, our procedure provably achieves moderate levels of robustness with little computational or statistical cost relative to empirical risk minimization. Furthermore, our statistical guarantees allow us to efficiently certify robustness for the population loss. For imperceptible perturbations, our method matches or outperforms heuristic approaches.* Equal contribution 1 Note that z, u ∈ R m , so trivially the dimensionality of the solution grows polynomially.2We assume that X is a subset of normed vector space.",,,
14096841,AN ACTOR-CRITIC ALGORITHM FOR SEQUENCE PREDICTION,"We present an approach to training neural networks to generate sequences using actor-critic methods from reinforcement learning (RL). Current log-likelihood training methods are limited by the discrepancy between their training and testing modes, as models must generate tokens conditioned on their previous guesses rather than the ground-truth tokens. We address this problem by introducing a critic network that is trained to predict the value of an output token, given the policy of an actor network. This results in a training procedure that is much closer to the test phase, and allows us to directly optimize for a task-specific score such as BLEU. Crucially, since we leverage these techniques in the supervised learning setting rather than the traditional RL setting, we condition the critic network on the ground-truth output. We show that our method leads to improved performance on both a synthetic task, and for German-English machine translation. Our analysis paves the way for such methods to be applied in natural language generation tasks, such as machine translation, caption generation, and dialogue modelling. * CIFAR Senior Fellow † CIFAR Fellow Published as a conference paper at ICLR 2017 from a sampled prediction lead to a high task-specific score, such as BLEU(Papineni et al., 2002)or ROUGE (Lin & Hovy, 2003).In this work, we propose and study an alternative procedure for training sequence prediction networks that aims to directly improve their test time metrics (which are typically not the log-likelihood). In particular, we train an additional network called the critic to output the value of each token, which we define as the expected task-specific score that the network will receive if it outputs the token and continues to sample outputs according to its probability distribution. Furthermore, we show how the predicted values can be used to train the main sequence prediction network, which we refer to as the actor. The theoretical foundation of our method is that, under the assumption that the critic computes exact values, the expression that we use to train the actor is an unbiased estimate of the gradient of the expected task-specific score.Our approach draws inspiration and borrows the terminology from the field of reinforcement learning (RL)(Sutton & Barto, 1998), in particular from the actor-critic approach(Sutton, 1984;Sutton et al., 1999;Barto et al., 1983). RL studies the problem of acting efficiently based only on weak supervision in the form of a reward given for some of the agent's actions. In our case, the reward is analogous to the task-specific score associated with a prediction. However, the tasks we consider are those of supervised learning, and we make use of this crucial difference by allowing the critic to use the ground-truth answer as an input. In other words, the critic has access to a sequence of expert actions that are known to lead to high (or even optimal) returns. To train the critic, we adapt the temporal difference methods from the RL literature(Sutton, 1988)to our setup. While RL methods with non-linear function approximators are not new(Tesauro, 1994;Miller et al., 1995), they have recently surged in popularity, giving rise to the field of 'deep RL'(Mnih et al., 2015). We show that some of the techniques recently developed in deep RL, such as having a target network, may also be beneficial for sequence prediction.The contributions of the paper can be summarized as follows: 1) we describe how RL methodology like the actor-critic approach can be applied to supervised learning problems with structured outputs; and 2) we investigate the performance and behavior of the new method on both a synthetic task and a real-world task of machine translation, demonstrating the improvements over maximum-likelihood and REINFORCE brought by the actor-critic training.",,,
14228101,Big Neural Networks Waste Capacity,"This article exposes the failure of some big neural networks to leverage added capacity to reduce underfitting. Past research suggest diminishing returns when increasing the size of neural networks. Our experiments on ImageNet LSVRC-2010 show that this may be due to the fact there are highly diminishing returns for capacity in terms of training error, leading to underfitting. This suggests that the optimization method -first order gradient descent -fails at this regime. Directly attacking this problem, either through the optimization method or the choices of parametrization, may allow to improve the generalization error on large datasets, for which a large capacity is required.",,,
14498604,Auto-pooling: Learning to Improve Invariance of Image Features from Image Sequences,"Learning invariant representations from images is one of the hardest challenges facing computer vision. Spatial pooling is widely used to create invariance to spatial shifting, but it is restricted to convolutional models. In this paper, we propose a novel pooling method that can learn soft clustering of features from image sequences. It is trained to improve the temporal coherence of features, while keeping the information loss at minimum. Our method does not use spatial information, so it can be used with non-convolutional models too. Experiments on images extracted from natural videos showed that our method can cluster similar features together. When trained by convolutional features, auto-pooling outperformed traditional spatial pooling on an image classification task, even though it does not use the spatial topology of features.",,,
14717992,REINFORCEMENT LEARNING WITH UNSUPERVISED AUXILIARY TASKS,"Deep reinforcement learning agents have achieved state-of-the-art results by directly maximising cumulative reward. However, environments contain a much wider variety of possible training signals. In this paper, we introduce an agent that also maximises many other pseudo-reward functions simultaneously by reinforcement learning. All of these tasks share a common representation that, like unsupervised learning, continues to develop in the absence of extrinsic rewards. We also introduce a novel mechanism for focusing this representation upon extrinsic rewards, so that learning can rapidly adapt to the most relevant aspects of the actual task. Our agent significantly outperforms the previous state-of-theart on Atari, averaging 880% expert human performance, and a challenging suite of first-person, three-dimensional Labyrinth tasks leading to a mean speedup in learning of 10× and averaging 87% expert human performance on Labyrinth.Natural and artificial agents live in a stream of sensorimotor data. At each time step t, the agent receives observations o t and executes actions a t . These actions influence the future course of the sensorimotor stream. In this paper we develop agents that learn to predict and control this stream, by solving a host of reinforcement learning problems, each focusing on a distinct feature of the sensorimotor stream. Our hypothesis is that an agent that can flexibly control its future experiences will also be able to achieve any goal with which it is presented, such as maximising its future rewards.The classic reinforcement learning paradigm focuses on the maximisation of extrinsic reward. However, in many interesting domains, extrinsic rewards are only rarely observed. This raises questions of what and how to learn in their absence. Even if extrinsic rewards are frequent, the sensorimotor stream contains an abundance of other possible learning targets. Traditionally, unsupervised learning attempts to reconstruct these targets, such as the pixels in the current or subsequent frame. It is typically used to accelerate the acquisition of a useful representation. In contrast, our learning objective is to predict and control features of the sensorimotor stream, by treating them as pseudorewards for reinforcement learning. Intuitively, this set of tasks is more closely matched with the agent's long-term goals, potentially leading to more useful representations.Consider a baby that learns to maximise the cumulative amount of red that it observes. To correctly predict the optimal value, the baby must understand how to increase ""redness"" by various means, including manipulation (bringing a red object closer to the eyes); locomotion (moving in front of a red object); and communication (crying until the parents bring a red object). These behaviours are likely to recur for many other goals that the baby may subsequently encounter. No understanding of these behaviours is required to simply reconstruct the redness of current or subsequent images.Our architecture uses reinforcement learning to approximate both the optimal policy and optimal value function for many different pseudo-rewards. It also makes other auxiliary predictions that serve to focus the agent on important aspects of the task. These include the long-term goal of predicting cumulative extrinsic reward as well as short-term predictions of extrinsic reward. To learn more efficiently, our agents use an experience replay mechanism to provide additional updates * Joint first authors. Ordered alphabetically by first name.",,,
