work_id,title,abstract_inverted_index,publication_year,type,language
261100891,Prediction without Preclusion: Recourse Verification with Reachable Sets,"Machine learning models are often used to decide who will receive a loan, a job interview, or a public benefit. Standard techniques to build these models use features about people but overlook their actionability. In turn, models can assign predictions that are fixed -meaning that consumers who are denied loans, interviews, or benefits may be permanently locked out from access to credit, employment, or assistance. In this work, we introduce a formal testing procedure to flag models that assign fixed predictions that we call recourse verification. We develop machinery to reliably determine if a given model can provide recourse to its decision subjects from a set of user-specified actionability constraints. We demonstrate how our tools can ensure recourse and adversarial robustness in real-world datasets and use them to study the infeasibility of recourse in real-world lending datasets. Our results highlight how models can inadvertently assign fixed predictions that permanently bar access, and we provide tools to design algorithms that account for actionability when developing models. arXiv:2308.12820v1 [cs.LG] 24 Aug 2023 2. We develop fast algorithms to delineate reachable sets from complex actionability constraints. Our algorithms can be used to ensure that a model can provide recourse in model development or deployment, and are designed to abstain when they are unable to certify recourse in order to avoid incorrect outputs.3. We present an empirical study of the infeasibility of recourse using several real-world datasets, realistic actionability constraints, and common model classes. Our results illustrate the prevalence of predictions without recourse in lending applications, and highlight pitfalls in flagging these examples with recourse provision. Finally, we demonstrate how our methods can be used to ensure recourse in consumer-facing applications like lending and content moderation.Related Work This work opens a new direction for research on algorithmic recourse, which studies how to change the prediction of a given model through actions in a feature space[73,75]. Much work on recourse develops methods for recourse provision -i.e., methods to provide a person with an action to change the prediction of a given model or, relatedly, counterfactual explanations -i.e., methods that explain a model's decision by showing what actions would change it [see e.g., 35, 18, 59, 42, 76, 77, 66, 38]. We focus instead on verification of models in terms of recourse feasibility -i.e., testing if a model assigns predictions that a given person can change using any feasible action. The need for verification arises because algorithmic recourse may be infeasible under realistic actionability constraints. Although actionability is a defining characteristic of recourse [see e.g., 75], the fact that such constraints may lead to infeasibility is not well-known in the literature. The exceptions [73, 43, 16] mention infeasibility but do not study it in detail. In contrast to the lack of attention in the literature, we show that recourse infeasibility is pervasive and is completely missed by most of the existing methods for recourse provision.",,,
261276856,ELUCIDATING THE EXPOSURE BIAS IN DIFFUSION MODELS,"Diffusion models have demonstrated impressive generative capabilities, but their exposure bias problem, described as the input mismatch between training and sampling, lacks in-depth exploration.In this paper, we systematically investigate the exposure bias problem in diffusion models by first analytically modelling the sampling distribution, based on which we then attribute the prediction error at each sampling step as the root cause of the exposure bias issue.Furthermore, we discuss potential solutions to this issue and propose an intuitive metric for it.Along with the elucidation of exposure bias, we propose a simple, yet effective, training-free method called Epsilon Scaling to alleviate the exposure bias.We show that Epsilon Scaling explicitly moves the sampling trajectory closer to the vector field learned in the training phase by scaling down the network output (Epsilon), mitigating the input mismatch between training and sampling.Experiments on various diffusion frameworks (ADM, DDPM/DDIM, EDM, LDM), unconditional and conditional settings, and deterministic vs. stochastic sampling verify the effectiveness of our method.Remarkably, our ADM-ES, as a SOTA stochastic sampler, obtains 2.17 FID on CIFAR-10 under 100-step unconditional generation.The code is available at https://github.com/forever208/ADM-ESand https://github.com/forever208/EDM-ESWe point out that the exposure bias problem in diffusion models lacks in-depth exploration.For example, there is no proper metric to quantify the exposure bias and no explicit error analysis for it.To shed light on exposure bias, we conduct a systematical investigation in this paper by first",,,
261530996,On Penalty Methods for Nonconvex Bilevel Optimization and First-Order Stochastic Approximation,"In this work, we study first-order algorithms for solving Bilevel Optimization (BO) where the objective functions are smooth but possibly nonconvex in both levels and the variables are restricted to closed convex sets. As a first step, we study the landscape of BO through the lens of penalty methods, in which the upper-and lower-level objectives are combined in a weighted sum with penalty parameter σ > 0. In particular, we establish a strong connection between the penalty function and the hyper-objective by explicitly characterizing the conditions under which the values and derivatives of the two must be O(σ)-close. A by-product of our analysis is the explicit formula for the gradient of hyper-objective when the lower-level problem has multiple solutions under minimal conditions, which could be of independent interest. Next, viewing the penalty formulation as O(σ)-approximation of the original BO, we propose firstorder algorithms that find an ϵ-stationary solution by optimizing the penalty formulation with σ = O(ϵ). When the perturbed lower-level problem uniformly satisfies the small-error proximal error-bound (EB) condition, we propose a first-order algorithm that converges to an ϵ-stationary point of the penalty function, using in total O(ϵ −3 ) and O(ϵ −7 ) accesses to first-order (stochastic) gradient oracles when the oracle is deterministic and oracles are noisy, respectively. Under an additional assumption on stochastic oracles, we show that the algorithm can be implemented in a fully single-loop manner, i.e., with O(1) samples per iteration, and achieves the improved oracle-complexity of O(ϵ −3 ) and O(ϵ −5 ), respectively.",,,
261557296,PROMPTTTS 2: DESCRIBING AND GENERATING VOICES WITH TEXT PROMPT,"Speech conveys more information than text, as the same word can be uttered in various voices to convey diverse information. Compared to traditional text-to-speech (TTS) methods relying on speech prompts (reference speech) for voice variability, using text prompts (descriptions) is more user-friendly since speech prompts can be hard to find or may not exist at all. TTS approaches based on the text prompt face two main challenges: 1) the one-to-many problem, where not all details about voice variability can be described in the text prompt, and 2) the limited availability of text prompt datasets, where vendors and large cost of data labeling are required to write text prompts for speech. In this work, we introduce PromptTTS 2 to address these challenges with a variation network to provide variability information of voice not captured by text prompts, and a prompt generation pipeline to utilize the large language models (LLM) to compose high quality text prompts. Specifically, the variation network predicts the representation extracted from the reference speech (which contains full information about voice variability) based on the text prompt representation. For the prompt generation pipeline, it generates text prompts for speech with a speech language understanding model to recognize voice attributes (e.g., gender, speed) from speech and a large language model to formulate text prompts based on the recognition results. Experiments on a large-scale (44K hours) speech dataset demonstrate that compared to the previous works, PromptTTS 2 generates voices more consistent with text prompts and supports the sampling of diverse voice variability, thereby offering users more choices on voice generation.",,,
261582259,RELAY DIFFUSION: UNIFYING DIFFUSION PROCESS ACROSS RESOLUTIONS FOR IMAGE SYNTHESIS,"Diffusion models achieved great success in image synthesis, but still face challenges in high-resolution generation. Through the lens of discrete cosine transformation, we find the main reason is that the same noise level on a higher resolution results in a higher Signal-to-Noise Ratio in the frequency domain. In this work, we present Relay Diffusion Model (RDM), which transfers a low-resolution image or noise into an equivalent high-resolution one for diffusion model via blurring diffusion and block noise. Therefore, the diffusion process can continue seamlessly in any new resolution or model without restarting from pure noise or lowresolution conditioning. RDM achieves state-of-the-art FID on CelebA-HQ and sFID on ImageNet 256×256, surpassing previous works such as ADM, LDM and DiT by a large margin. All the codes and checkpoints are open-sourced at https://github.com/THUDM/RelayDiffusion. Figure 1: (left): Generated Samples by RDM on ImageNet 256×256 and CelebA-HQ 256×256. (right): Benchmarking recent diffusion models on class-conditional ImageNet 256×256 generation without any guidance. RDM can achieve a FID of 1.87 if with classifier-free guidance. arXiv:2309.03350v1 [cs.CV] 4 Sep 2023Preprint generative models in recent years. However, challenges still exist in the training of diffusion models for high-resolution images. More specifically, there are two main obstacles:Training Efficiency. Although equipped with UNet to balance the memory and computation cost across different resolutions, diffusion models still require a large amount of resources to train on high-resolution images. One popular solution is to train the diffusion model on a latent (usually 4× compression rate in resolution) space and map the result back as pixels(Rombach et al., 2022), which is fast but inevitably suffers from some low-level artifacts. The cascaded method  trains a series of varying-size super-resolution diffusion models, which is effective but needs a complete sampling for each stage separately.Noise Schedule. Diffusion models need a noise schedule to control the amount of the isotropic Gaussian noise at each step. The setting of the noise schedule shows great influence over the performance, and most current models follow the linear (Ho et al., 2020) or cosine  schedule. However, an ideal noise schedule should be resolution-dependent (SeeFigure 2or Chen (2023)), resulting in suboptimal performance to train high-resolution models directly with common schedules designed for resolutions of 32×32 or 64×64 pixels.",,,
261682321,UNIFIED LANGUAGE-VISION PRETRAINING IN LLM WITH DYNAMIC DISCRETE VISUAL TOKENIZATION,"Recently, the remarkable advance of the Large Language Model (LLM) has inspired researchers to transfer its extraordinary reasoning capability to both vision and language data. However, the prevailing approaches primarily regard the visual input as a prompt and focus exclusively on optimizing the text generation process conditioned upon vision content by a frozen LLM. Such an inequitable treatment of vision and language heavily constrains the model's potential. In this paper, we break through this limitation by representing both vision and language in a unified form. Specifically, we introduce a well-designed visual tokenizer to translate the non-linguistic image into a sequence of discrete tokens like a foreign language that LLM can read. The resulting visual tokens encompass high-level semantics worthy of a word and also support dynamic sequence length varying from the image. Coped with this tokenizer, the presented foundation model called LaVIT can handle both image and text indiscriminately under the same generative learning paradigm. This unification empowers LaVIT to serve as an impressive generalist interface to understand and generate multi-modal content simultaneously. Extensive experiments further showcase that it outperforms the existing models by a large margin on massive vision-language tasks. Our code and models will be available at https://github.com/jy0205/LaVIT. * Work done during an internship at Kuaishou Technology.",,,
261696697,MAMMOTH: BUILDING MATH GENERALIST MODELS THROUGH HYBRID INSTRUCTION TUNING,"We introduce MAmmoTH, a series of open-source large language models (LLMs) specifically tailored for general math problem-solving.The MAmmoTH models are trained on MathInstruct, our meticulously curated instruction tuning dataset.MathInstruct is compiled from 13 math datasets with intermediate rationales, six of which have rationales newly curated by us.It presents a unique hybrid of chain-of-thought (CoT) and program-of-thought (PoT) rationales, and also ensures extensive coverage of diverse fields in math.The hybrid of CoT and PoT not only unleashes the potential of tool use but also allows different thought processes for different math problems.As a result, the MAmmoTH series substantially outperform existing open-source models on nine mathematical reasoning datasets across all scales with an average accuracy gain between 16% and 32%.Remarkably, our MAmmoTH-7B model reaches 33% on MATH (a competition-level dataset), which exceeds the best open-source 7B model (WizardMath) by 23%, and the MAmmoTH-34B model achieves 44% accuracy on MATH, even surpassing GPT-4's CoT result.Our work underscores the importance of diverse problem coverage and the use of hybrid rationales in developing superior math generalist models.",,,
262013288,Headless Language Models: Learning without Predicting with Contrastive Weight Tying,"Self-supervised pre-training of language models usually consists in predicting probability distributions over extensive token vocabularies.In this study, we propose an innovative method that shifts away from probability prediction and instead focuses on reconstructing input embeddings in a contrastive fashion via Constrastive Weight Tying (CWT).We apply this approach to pretrain Headless Language Models in both monolingual and multilingual contexts.Our method offers practical advantages, substantially reducing training computational requirements by up to 20 times, while simultaneously enhancing downstream performance and data efficiency.We observe a significant +1.6 GLUE score increase and a notable +2.7 LAMBADA accuracy improvement compared to classical LMs within similar compute budgets.",,,
262054014,UNDERSTANDING CATASTROPHIC FORGETTING IN LANGUAGE MODELS VIA IMPLICIT INFERENCE,"Fine-tuning (via methods such as instruction-tuning or reinforcement learning from human feedback) is a crucial step in training language models to robustly carry out tasks of interest.However, we lack a systematic understanding of the effects of fine-tuning, particularly on tasks outside the narrow fine-tuning distribution.In a simplified scenario, we demonstrate that improving performance on tasks within the fine-tuning data distribution comes at the expense of suppressing model capabilities on other tasks.This degradation is especially pronounced for tasks ""closest"" to the fine-tuning distribution.We hypothesize that language models implicitly infer the task of the prompt corresponds, and the fine-tuning process predominantly skews this task inference towards tasks in the fine-tuning distribution.To test this hypothesis, we propose Conjugate Prompting to see if we can recover pretrained capabilities.Conjugate prompting artificially makes the task look farther from the fine-tuning distribution while requiring the same capability.We find that conjugate prompting systematically recovers some of the pretraining capabilities on our synthetic setup.We then apply conjugate prompting to real-world LLMs using the observation that fine-tuning distributions are typically heavily skewed towards English.We find that simply translating the prompts to different languages can cause the fine-tuned models to respond like their pretrained counterparts instead.This allows us to recover the in-context learning abilities lost via instruction tuning, and more concerningly, to recover harmful content generation suppressed by safety fine-tuning in chatbots like ChatGPT.",,,
262828485,GUESS & SKETCH: LANGUAGE MODEL GUIDED TRANSPILATION,"Maintaining legacy software requires many software and systems engineering hours.Assembly code programs, which demand low-level control over the computer machine state and have no variable names, are particularly difficult for humans to analyze.Existing conventional program translators guarantee correctness, but are hand-engineered for the source and target programming languages in question.Learned transpilation, i.e. automatic translation of code, offers an alternative to manual re-writing and engineering efforts.Automated symbolic program translation approaches guarantee correctness but struggle to scale to longer programs due to the exponentially large search space.Their rigid rule-based systems also limit their expressivity, so they can only reason about a reduced space of programs.Probabilistic neural language models (LMs) produce plausible outputs for every input, but do so at the cost of guaranteed correctness.In this work, we leverage the strengths of LMs and symbolic solvers in a neurosymbolic approach to learned transpilation for assembly code.Assembly code is an appropriate setting for a neurosymbolic approach, since assembly code can be divided into shorter non-branching basic blocks amenable to the use of symbolic methods.GUESS & SKETCH extracts alignment and confidence information from features of the LM then passes it to a symbolic solver to resolve semantic equivalence of the transpilation input and output.We test GUESS & SKETCH on three different test sets of assembly transpilation tasks, varying in difficulty, and show that it successfully transpiles 57.6% more examples than GPT-4 and 39.6% more examples than an engineered transpiler.We also share a training and evaluation dataset for this task.",,,
262944419,Identifying the Risks of LM Agents with an LM-Emulated Sandbox,"Recent advances in Language Model (LM) agents and tool use, exemplified by applications like ChatGPT Plugins, enable a rich set of capabilities but also amplify potential risks-such as leaking private data or causing financial losses. Identifying these risks is labor-intensive, necessitating implementing the tools, setting up the environment for each test scenario manually, and finding risky cases. As tools and agents become more complex, the high cost of testing these agents will make it increasingly difficult to find high-stakes, long-tail risks. To address these challenges, we introduce ToolEmu: a framework that uses a LM to emulate tool execution and enables scalable testing of LM agents against a diverse range of tools and scenarios. Alongside the emulator, we develop an LM-based automatic safety evaluator that examines agent failures and quantifies associated risks. We test both the tool emulator and evaluator through human evaluation and find that 68.8% of failures identified with ToolEmu would be valid real-world agent failures. Using our curated initial benchmark consisting of 36 high-stakes tools and 144 test cases, we provide a quantitative risk analysis of current LM agents and identify numerous failures with potentially severe outcomes. Notably, even the safest LM agent exhibits such failures 23.9% of the time according to our evaluator, underscoring the need to develop safer LM agents for real-world deployment. 1 * Equal contribution. Contact {yjruan, honghuad}@cs.toronto.edu. 1 Project website, demo, and open-source code can be found at",,,
263123363,Coreference Resolution with and without Linguistic Knowledge,"State-of-the-art statistical approaches to the Coreference Resolution task rely on sophisticated modeling, but very few (10-20) simple features. In this paper we propose to extend the standard feature set substantially, incorporating more linguistic knowledge. To investigate the usability of linguistically motivated features, we evaluate our system for a variety of machine learners on the standard dataset (MUC-7) with the traditional learning set-up (Soon et al., 2001).",,,
263152829,HOW TO CATCH AN AI LIAR: LIE DETECTION IN BLACK-BOX LLMS BY ASKING UNRELATED QUESTIONS,"Large language models (LLMs) can ""lie"", which we define as outputting false statements despite ""knowing"" the truth in a demonstrable sense.LLMs might ""lie"", for example, when instructed to output misinformation.Here, we develop a simple lie detector that requires neither access to the LLM's activations (black-box) nor ground-truth knowledge of the fact in question.The detector works by asking a predefined set of unrelated follow-up questions after a suspected lie, and feeding the LLM's yes/no answers into a logistic regression classifier.Despite its simplicity, this lie detector is highly accurate and surprisingly general.When trained on examples from a single setting-prompting GPT-3.5 to lie about factual questionsthe detector generalises out-of-distribution to (1) other LLM architectures, (2) LLMs fine-tuned to lie, (3) sycophantic lies, and (4) lies emerging in real-life scenarios such as sales.These results indicate that LLMs have distinctive lierelated behavioural patterns, consistent across architectures and contexts, which could enable general-purpose lie detection.",,,
263311025,CAN SENSITIVE INFORMATION BE DELETED FROM LLMS? OBJECTIVES FOR DEFENDING AGAINST EXTRACTION ATTACKS,"Pretrained language models sometimes possess knowledge that we do not wish them to, including memorized personal information and knowledge that could be used to harm people. They can also output toxic or harmful text. To mitigate these safety and informational issues, we propose an attack-and-defense framework for studying the task of deleting sensitive information directly from model weights. We study direct edits to model weights because (1) this approach should guarantee that particular deleted information is never extracted by future prompt attacks, and (2) it should protect against whitebox attacks, which is necessary for making claims about safety/privacy in a setting where publicly available model weights could be used to elicit sensitive information. Our threat model assumes that an attack succeeds if the answer to a sensitive question is located among a set of B generated candidates, based on scenarios where the information would be insecure if the answer is among B candidates. Experimentally, we show that even state-of-the-art model editing methods such as ROME struggle to truly delete factual information from models like GPT-J, as our whitebox and blackbox attacks can recover ""deleted"" information from an edited model 38% of the time. These attacks leverage two key observations: (1) that traces of deleted information can be found in intermediate model hidden states, and (2) that applying an editing method for one question may not delete information across rephrased versions of the question. Finally, we provide new defense methods that protect against some extraction attacks, but we do not find a single universally effective defense method. Our results suggest that truly deleting sensitive information is a tractable but difficult problem, since even relatively low attack success rates have potentially severe implications for the deployment of language models in a world where individuals enjoy ownership of their personal data, a right to privacy, and safety from harmful model outputs. 1 * Equal contribution. 1 Our code is available at: https://github.com/Vaidehi99/InfoDeletionAttacks arXiv:2309.17410v1 [cs.CL] 29 Sep 2023• How can we ""delete"" specific sensitive information from language models when we do not want models to know or express this information?• How do we test whether that specific information was successfully deleted?Language ModelLanguage Model",,,
