work_id,title,abstract_inverted_index,publication_year,type,language
251554821,DIFFUSION POLICIES AS AN EXPRESSIVE POLICY CLASS FOR OFFLINE REINFORCEMENT LEARNING,"Offline reinforcement learning (RL), which aims to learn an optimal policy using a previously collected static dataset, is an important paradigm of RL. Standard RL methods often perform poorly in this regime due to the function approximation errors on out-of-distribution actions. While a variety of regularization methods have been proposed to mitigate this issue, they are often constrained by policy classes with limited expressiveness that can lead to highly suboptimal solutions. In this paper, we propose representing the policy as a diffusion model, a recent class of highly-expressive deep generative models. We introduce Diffusion Qlearning (Diffusion-QL) that utilizes a conditional diffusion model to represent the policy. In our approach, we learn an action-value function and we add a term maximizing action-values into the training loss of the conditional diffusion model, which results in a loss that seeks optimal actions that are near the behavior policy. We show the expressiveness of the diffusion model-based policy, and the coupling of the behavior cloning and policy improvement under the diffusion model both contribute to the outstanding performance of Diffusion-QL. We illustrate the superiority of our method compared to prior works in a simple 2D bandit example with a multimodal behavior policy. We then show that our method can achieve state-of-the-art performance on the majority of the D4RL benchmark tasks. * The work was done in part during a summer internship at Twitter. † Joint senior authors; order determined by flipping a coin. arXiv:2208.06193v3 [cs.LG] 25 Aug 2023Published as a conference paper at ICLR 2023ICLR     et al., 2020Yu et al., 2021); 4) treating offline RL as a problem of sequence prediction with return guidance (Chen et al., 2021; Janner et al., 2021;. Our approach falls into the first category.Empirically, the performance of policy-regularized offline RL methods is typically slightly worse than that of other approaches, and here we show that this is largely because the policy regularization methods perform poorly due to their limited ability to accurately represent the behavior policy. This results in the regularization adversely affecting the policy improvement. For example, the policy regularization may limit the exploration space of the agent to a small region with only suboptimal actions and then the Q-learning will be induced to converge towards a suboptimal policy.The inaccurate policy regularization occurs for two main reasons: 1) policy classes are not expressive enough; 2) the regularization methods are improper. In most prior work, the policy is a Gaussian distribution with mean and diagonal covariance specified by the output of a neural network. However, as offline datasets are often collected by a mixture of policies, the true behavior policy may exhibit strong multi-modalities, skewness, or dependencies between different action dimensions, which cannot be well modeled by diagonal Gaussian policies(Shafiullah et al., 2022). In a particularly extreme, but not uncommon example, a Gaussian policy is used to fit bimodal training data by minimizing the Kullback-Leibler (KL) divergence from the data distribution to the policy distribution. This will result in the policy exhibiting mode-covering behavior and placing high density in the middle area of the two modes, which is actually the low-density region of the training data. In such cases, regularizing a new policy towards the behavior-cloned policy is likely to make the policy learning substantially worse. Second, the regularization, such as the KL divergence and maximum mean discrepancy (MMD) (Kumar et al., 2019), is often not well suited for offline RL. The KL divergence needs access to explicit density values and MMD needs multiple action samples at each state for optimization. These methods require an extra step by first learning a behavior cloned policy to provide density values for KL optimization or random action samples for MMD optimization. Regularizing the current policy towards the behavior cloned policy can further induce approximation errors, since the cloned behavior policy may not model the true behavior policy well, due to limitations in the expressiveness of the policy class. We conduct a simple bandit experiment in Section 4, which illustrates these issues can occur even on a simple bandit task.",,,
251979354,Published as a conference paper at ICLR 2023 TRANSFORMERS ARE SAMPLE-EFFICIENT WORLD MODELS,"Deep reinforcement learning agents are notoriously sample inefficient, which considerably limits their application to real-world problems. Recently, many model-based methods have been designed to address this issue, with learning in the imagination of a world model being one of the most prominent approaches. However, while virtually unlimited interaction with a simulated environment sounds appealing, the world model has to be accurate over extended periods of time. Motivated by the success of Transformers in sequence modeling tasks, we introduce IRIS, a data-efficient agent that learns in a world model composed of a discrete autoencoder and an autoregressive Transformer. With the equivalent of only two hours of gameplay in the Atari 100k benchmark, IRIS achieves a mean human normalized score of 1.046, and outperforms humans on 10 out of 26 games, setting a new state of the art for methods without lookahead search. To foster future research on Transformers and world models for sample-efficient reinforcement learning, we release our code and models at https://github.com/eloialonso/iris. , et al. Human-level control through deep reinforcement learning. Nature, 518(7540):529-533, 2015. Silver. Mastering atari, go, chess and shogi by planning with a learned model. Nature, 588(7839): 604-609, 2020.",,,
252089864,Faster federated optimization under second-order similarity,"Federated learning (FL) is a subfield of machine learning where multiple clients try to collaboratively learn a model over a network under communication constraints. We consider finite-sum federated optimization under a second-order function similarity condition and strong convexity, and propose two new algorithms: SVRP and Catalyzed SVRP. This second-order similarity condition has grown popular recently, and is satisfied in many applications including distributed statistical learning and differentially private empirical risk minimization. The first algorithm, SVRP, combines approximate stochastic proximal point evaluations, client sampling, and variance reduction. We show that SVRP is communication efficient and achieves superior performance to many existing algorithms when function similarity is high enough. Our second algorithm, Catalyzed SVRP, is a Catalyst-accelerated variant of SVRP that achieves even better performance and uniformly improves upon existing algorithms for federated optimization under second-order similarity and strong convexity. In the course of analyzing these algorithms, we provide a new analysis of the Stochastic Proximal Point Method (SPPM) that might be of independent interest. Our analysis of SPPM is simple, allows for approximate proximal point evaluations, does not require any smoothness assumptions, and shows a clear benefit in communication complexity over ordinary distributed stochastic gradient descent.arXiv:2209.02257v2 [cs.LG] 23 May 2023We answer the above question in the affirmative and show the utility of using client sampling in optimization under second-order similarity for strongly convex objectives. Our main contributions are as follows:• A new algorithm for federated optimization (SVRP, Algorithm 2). We develop a new algorithm, SVRP (Stochastic Variance-Reduced Proximal Point), that utilizes client sampling to improve upon the existing algorithms for solving Problem 1 under second-order similarity. SVRP has a better dependence on the number of clients M in its communication complexity than all existing algorithms (seeTable 1), and achieves superior performance when the dissimilarity constant δ is small enough. SVRP trades off a higher computational complexity for less communication.• Catalyst-accelerated SVRP. By using Catalyst (Lin et al., 2015), we accelerate SVRP and obtain a new algorithm (Catalyzed SVRP) that improves the dependence on the effective conditioning from δ 2 µ 2 to δ µ . Catalyzed SVRP also has a better convergence rate (in number of communication steps, ignoring constants and logarithmic factors) than all existing accelerated algorithms for this problem under Assumption 1, reducing the dependence on the number of clients multiplied by the effective conditioning δ µ from δ µ M to δ µ M 3/4 (seeTable 1).While both SVRP and Catalyzed SVRP achieve a communication complexity that is better than algorithms designed for the standard finite-sum setting (like SVRG or SAGA), the computational complexity is a lot worse. This is because we tradeoff local computation complexity for a reduced communication complexity. Additionally, both SVRP and Catalyzed SVRP are based upon a novel combination of variance-reduction techniques and the stochastic proximal point method (SPPM). SPPM is our starting point, and we provide a new analysis for it that might be of independent interest. Our analysis of SPPM is simple, allows for approximate evaluations of the proximal operator, and extends to include variance reduction. In Section 15 we also consider the more general constrained optimization problem and provide similar convergence rates in that setting.Related workDistributed optimization under Assumption 1. There is a long line of work analyzing distributed optimization under Assumption 1 and strong convexity: Shamir et al. (2014)  first gave DANE and analyzed it for quadratics, and showed the benefits of using second-order similarity in the setting of statistical learning for quadratic objectives. Zhang and Lin(2015)developed the DiSCO algorithm that improved upon DANE for quadratics, and also analyzed it for self-concordant objectives. Arjevani and Shamir(2015)gave a lower bound that matched the rate given by DANE, though without allowing for client sampling. The theory of DANE was later improved in (Yuan and Li, 2019), allowing for local convergence for non-quadratic objectives. Another algorithm SCAFFOLD (Karimireddy et al., 2020b) can be seen as a variant of DANE and is also analyzed for quadratics. In the context of decentralized optimization, Sun et al. (2022) gave SONATA and showed a similar rate to DANE but for general strongly convex objectives, then Tian et al. (2022) improved the convergence rate of SONATA by acceleration. Finally, Kovalev et al. (2022) improved the convergence rate of accelerated SONATA even further by removing extra logarithmic factors.We give an overview of all related results inTable 1and provide more thorough comparisons in the theory and algorithms section.",,,
252222370,Published as a conference paper at ICLR 2023 CLIP-VIP: ADAPTING PRE-TRAINED IMAGE-TEXT MODEL TO VIDEO-LANGUAGE ALIGNMENT,"Pre-trained image-text models, like CLIP, have demonstrated the strong power of vision-language representation learned from a large scale of web-collected image-text data. In light of the well-learned visual features, there are works that transfer image representation to the video domain and achieve good results. However, adapting image-text pre-trained models to video-text pre-training (i.e., post-pretraining) has not demonstrated a significant advantage yet. In this paper, we tackle this challenge by raising and addressing two questions: 1) what are the factors hindering post-pretraining CLIP from improving performance on video-text tasks, and 2) how to mitigate the impact of these factors. Through a series of comparative experiments and analyses, we find that the data scale and domain gap between language sources have large impacts. By these observations, we propose an Omnisource Cross-modal Learning method equipped with a Video Proxy mechanism on the basis of CLIP, namely CLIP-ViP. Extensive results show that our approach improves the performance of CLIP on video-text retrieval by a large margin. Our model achieves state-of-the-art results on a variety of datasets, including MSR-VTT, DiDeMo, LSMDC, and Ac-tivityNet. We release our code and pre-trained CLIP-ViP models at https: //github.com/microsoft/XPretrain/tree/main/CLIP-ViP.",,,
252408513,Published as a conference paper at ICLR 2023 GENERATE RATHER THAN RETRIEVE: LARGE LANGU- AGE MODELS ARE STRONG CONTEXT GENERATORS,"Knowledge-intensive tasks, such as open-domain question answering (QA), require access to a large amount of world or domain knowledge. A common approach for knowledge-intensive tasks is to employ a retrieve-then-read pipeline that first retrieves a handful of relevant contextual documents from an external corpus such as Wikipedia and then predicts an answer conditioned on the retrieved documents. In this paper, we present a novel perspective for solving knowledge-intensive tasks by replacing document retrievers with large language model generators. We call our method generate-then-read (GENREAD), which first prompts a large language model to generate contextual documents based on a given question, and then reads the generated documents to produce the final answer. Furthermore, we propose a novel clustering-based prompting method that selects distinct prompts, in order to generate diverse documents that cover different perspectives, leading to better recall over acceptable answers. We conduct extensive experiments on three different knowledge-intensive tasks, including open-domain QA, fact checking, and dialogue system. Notably, GENREAD achieves 71.6 and 54.4 exact match scores on TriviaQA and WebQ, significantly outperforming the state-of-the-art retrieve-thenread pipeline DPR-FiD by +4.0 and +3.9, without retrieving any documents from any external knowledge source. Lastly, we demonstrate the model performance can be further improved by combining retrieval and generation. Our code and generated documents can be found at https://github.com/wyu97/GenRead. § Unless otherwise specified, we use the text-davinci-002 version of InstructGPT in our experiments. * Work done during internship at Microsoft Cognitive Service Research group.",,,
252519173,PROMPTAGATOR : FEW-SHOT DENSE RETRIEVAL FROM 8 EXAMPLES,"Much recent research on information retrieval has focused on how to transfer from one task (typically with abundant supervised data) to various other tasks where supervision is limited, with the implicit assumption that it is possible to generalize from one task to all the rest. However, this overlooks the fact that there are many diverse and unique retrieval tasks, each targeting different search intents, queries, and search domains. In this paper, we suggest to work on Few-shot Dense Retrieval, a setting where each task comes with a short description and a few examples. To amplify the power of a few examples, we propose Promptbase Query Generation for Retriever (PROMPTAGATOR ), which leverages large language models (LLM) as a few-shot query generator, and creates task-specific retrievers based on the generated data. Powered by LLM's generalization ability, PROMPTAGATOR makes it possible to create task-specific end-to-end retrievers solely based on a few examples without using Natural Questions(Kwiatkowski et al., 2019)or MS MARCO (Nguyen et al., 2016)  to train dual encoders. Surprisingly, LLM prompting with no more than 8 examples allows dual encoders to outperform heavily engineered models trained on MS MARCO like ColBERT v2(Santhanam et al., 2022)by more than 1.2 nDCG on average on 11 retrieval sets. Further training standard-size re-rankers using the same generated data yields another 5.0 point nDCG improvement. Our studies determine that query generation can be far more effective than previously observed, especially when a small amount of task-specific knowledge is given.",,,
252519395,Achieve the Minimum Width of Neural Net- works for Universal Approximation,"The universal approximation property (UAP) of neural networks is fundamental for deep learning, and it is well known that wide neural networks are universal approximators of continuous functions within both the L p norm and the continuous/uniform norm. However, the exact minimum width, w min , for the UAP has not been studied thoroughly. Recently, using a decoder-memorizer-encoder scheme, Park et al.(2021)found that w min = max(d x + 1, d y ) for both the L p -UAP of ReLU networks and the C-UAP of ReLU+STEP networks, where d x , d y are the input and output dimensions, respectively. In this paper, we consider neural networks with an arbitrary set of activation functions. We prove that both C-UAP and L p -UAP for functions on compact domains share a universal lower bound of the minimal width; that is, w * min = max(d x , d y ). In particular, the critical width, w * min , for L p -UAP can be achieved by leaky-ReLU networks, provided that the input or output dimension is larger than one. Our construction is based on the approximation power of neural ordinary differential equations and the ability to approximate flow maps by neural networks. The nonmonotone or discontinuous activation functions case and the one-dimensional case are also discussed.Published as a conference paper at ICLR 2023 2, d y + 1). A summary of known upper/lower bounds on minimum width for the UAP can be found in Park et al. (2021).",,,
252544861,HIERARCHICAL SLICED WASSERSTEIN DISTANCE,"Sliced Wasserstein (SW) distance has been widely used in different application scenarios since it can be scaled to a large number of supports without suffering from the curse of dimensionality. The value of sliced Wasserstein distance is the average of transportation cost between one-dimensional representations (projections) of original measures that are obtained by Radon Transform (RT). Despite its efficiency in the number of supports, estimating the sliced Wasserstein requires a relatively large number of projections in high-dimensional settings. Therefore, for applications where the number of supports is relatively small compared with the dimension, e.g., several deep learning applications where the mini-batch approaches are utilized, the complexities from matrix multiplication of Radon Transform become the main computational bottleneck. To address this issue, we propose to derive projections by linearly and randomly combining a smaller number of projections which are named bottleneck projections. We explain the usage of these projections by introducing Hierarchical Radon Transform (HRT) which is constructed by applying Radon Transform variants recursively. We then formulate the approach into a new metric between measures, named Hierarchical Sliced Wasserstein (HSW) distance. By proving the injectivity of HRT, we derive the metricity of HSW. Moreover, we investigate the theoretical properties of HSW including its connection to SW variants and its computational and sample complexities. Finally, we compare the computational cost and generative quality of HSW with the conventional SW on the task of deep generative modeling using various benchmark datasets including CIFAR10, CelebA, and Tiny ImageNet 1 .arXiv:2209.13570v5 [stat.ML] 6 Feb 2023Published as a conference paper at ICLR 2023 applications (Le et al., 2021;Xu et al., 2021;Yang et al., 2020). Despite the increasing importance of Wasserstein distance in applications, prior works have alluded to the concerns surrounding the high computational complexity of that distance. When the probability measures have at most n supports, the computational complexity of Wasserstein distance scales with the order of O(n 3 log n) (Pele & Werman, 2009). Additionally, it suffers from the curse of dimensionality, i.e., its sample complexity (the bounding gap of the distance between a probability measure and the empirical measures from its random samples) is of the order of O(n −1/d ) (Fournier & Guillin, 2015), where n is the sample size and d is the number of dimensions.Published as a conference paper at ICLR 2023 randomly from the uniform distribution over the corresponding unit-hypersphere. For the same value of L, we show that the bottleneck projection approach is faster than the conventional approach when the values of L and d are large.Contribution: In summary, our main contributions are two-fold:Published as a conference paper at ICLR 2023 Kilian Fatras, Younes Zine, Rémi Flamary, Rémi Gribonval, and Nicolas Courty. Learning with minibatch Wasserstein: asymptotic and gradient properties.",,,
252595735,Published as a conference paper at ICLR 2023 SPOTLIGHT: MOBILE UI UNDERSTANDING USING VISION-LANGUAGE MODELS WITH A FOCUS,"Mobile UI understanding is important for enabling various interaction tasks such as UI automation and accessibility. Previous mobile UI modeling often depends on the view hierarchy information of a screen, which directly provides the structural data of the UI, with the hope to bypass challenging tasks of visual modeling from screen pixels. However, view hierarchies are not always available, and are often corrupted with missing object descriptions or misaligned structure information. As a result, despite the use of view hierarchies could offer short-term gains, it may ultimately hinder the applicability and performance of the model. In this paper, we propose Spotlight, a vision-only approach for mobile UI understanding. Specifically, we enhance a vision-language model that only takes the screenshot of the UI and a region of interest on the screen-the focus-as the input. This general architecture of Spotlight is easily scalable and capable of performing a range of UI modeling tasks. Our experiments show that our model establishes SoTA results on several representative UI tasks and outperforms previous methods that use both screenshots and view hierarchies as inputs. Furthermore, we explore multi-task learning and few-shot prompting capacities of the proposed models, demonstrating promising results in the multi-task learning direction.",,,
252596087,RE-IMAGEN: RETRIEVAL-AUGMENTED TEXT-TO-IMAGE GENERATOR,"Research on text-to-image generation has witnessed significant progress in generating diverse and photo-realistic images, driven by diffusion and auto-regressive models trained on large-scale image-text data. Though state-of-the-art models can generate high-quality images of common entities, they often have difficulty generating images of uncommon entities, such as 'Chortai (dog)' or 'Picarones (food)'. To tackle this issue, we present the Retrieval-Augmented Text-to-Image Generator (Re-Imagen), a generative model that uses retrieved information to produce high-fidelity and faithful images, even for rare or unseen entities. Given a text prompt, Re-Imagen accesses an external multi-modal knowledge base to retrieve relevant (image, text) pairs and uses them as references to generate the image. With this retrieval step, Re-Imagen is augmented with the knowledge of highlevel semantics and low-level visual details of the mentioned entities, and thus improves its accuracy in generating the entities' visual appearances. We train Re-Imagen on a constructed dataset containing (image, text, retrieval) triples to teach the model to ground on both text prompt and retrieval. Furthermore, we develop a new sampling strategy to interleave the classifier-free guidance for text and retrieval conditions to balance the text and retrieval alignment. Re-Imagen achieves significant gain on FID score over COCO and WikiImage. To further evaluate the capabilities of the model, we introduce EntityDrawBench, a new benchmark that evaluates image generation for diverse entities, from frequent to rare, across multiple object categories including dogs, foods, landmarks, birds, and characters. Human evaluation on EntityDrawBench shows that Re-Imagen can significantly improve the fidelity of generated images, especially on less frequent entities.",,,
252596252,DIFFUSION POSTERIOR SAMPLING FOR GENERAL NOISY INVERSE PROBLEMS,"Diffusion models have been recently studied as powerful generative inverse problem solvers, owing to their high quality reconstructions and the ease of combining existing iterative solvers. However, most works focus on solving simple linear inverse problems in noiseless settings, which significantly under-represents the complexity of real-world problems. In this work, we extend diffusion solvers to efficiently handle general noisy (non)linear inverse problems via approximation of the posterior sampling. Interestingly, the resulting posterior sampling scheme is a blended version of diffusion sampling with the manifold constrained gradient without a strict measurement consistency projection step, yielding a more desirable generative path in noisy settings compared to the previous studies. Our method demonstrates that diffusion models can incorporate various measurement noise statistics such as Gaussian and Poisson, and also efficiently handle noisy nonlinear inverse problems such as Fourier phase retrieval and non-uniform deblurring.",,,
